{
  "artifact_id": "operativa/tasks/20260623/CEO_PRODUCTIVE_CELL_G1_BACKLOG_20260623",
  "categoria": "operativa",
  "tipo": "matriz",
  "estado": "en_revision",
  "version": "v0.6.0-rc1",
  "fecha_evento": "2026-06-23",
  "autoridad": {
    "tipo": "sistema",
    "referencia": "CABINA_GOBERNADA_PRODUCTIVA_G1"
  },
  "origen": "GitHub",
  "ubicacion_repo": "operativa/tasks/20260623/CEO_PRODUCTIVE_CELL_G1_BACKLOG_20260623.csv",
  "etiquetas": [
    "backlog",
    "productiva",
    "automation",
    "local-only"
  ],
  "relacionados": [
    "operativa/tasks/20260623/READBACK_CEO_PRODUCTIVE_CELL_G1_20260623.md"
  ],
  "descripcion": "Backlog productivo G1 con proximas automatizaciones y gates listos para decision."
}

