{
  "artifact_id": "operativa/archive/legacy-root/20260617/CLOUD_DATAVERSE_PREFLIGHT_20260617",
  "categoria": "operativa",
  "tipo": "matriz",
  "estado": "en_revision",
  "version": "2026.06.21",
  "autoridad": {
    "tipo": "owner",
    "referencia": "@SeshatSgin"
  },
  "origen": "GitHub",
  "ubicacion_repo": "operativa/archive/legacy-root/20260617/CLOUD_DATAVERSE_PREFLIGHT_20260617.csv",
  "etiquetas": [
    "operativa",
    "matriz",
    "metadata",
    "cloud",
    "dataverse",
    "preflight"
  ],
  "relacionados": [
    "operativa/MAPA.md"
  ],
  "descripcion": "Resultado de preflight cloud Dataverse con trazabilidad parcial.",
  "fecha_evento": "2026-06-17"
}
