{
  "artifact_id": "operativa/tasks/20260623/IDE_WORKSPACE_IDENTITY_RECONCILIATION_MATRIX_20260623",
  "categoria": "operativa",
  "tipo": "matriz",
  "estado": "en_revision",
  "version": "v0.6.0-rc1",
  "fecha_evento": "2026-06-23",
  "autoridad": {
    "tipo": "sistema",
    "referencia": "IDE_WORKSPACE_IDENTITY_RECONCILIATION"
  },
  "origen": "GitHub",
  "ubicacion_repo": "operativa/tasks/20260623/IDE_WORKSPACE_IDENTITY_RECONCILIATION_MATRIX_20260623.csv",
  "etiquetas": [
    "vscode-insiders",
    "workspace-identity",
    "local-only",
    "productiva"
  ],
  "relacionados": [
    "operativa/tasks/20260623/READBACK_IDE_WORKSPACE_IDENTITY_RECONCILIATION_20260623.md",
    "tools/ceo-ide-workspace-reconcile.ps1",
    "tools/ceo-vscode-insiders-open.ps1",
    "tools/ceo-vscode-insiders-status.ps1"
  ],
  "descripcion": "Matriz minima para reconciliar la identidad de workspace VS Code Insiders hacia C:\\CEO\\project-cdx sin borrar caches ni workspaceStorage."
}
